{
  "$schema": "https://json-schema.org/draft/2020-12/schema",
  "$id": "https://dotacni-majak.cz/schema/v1/grant-submission.schema.json",
  "title": "GrantSubmission",
  "type": "object",
  "additionalProperties": false,
  "description": "Praktické informace nutné k podání žádosti pro konkrétní verzi GrantCall. Modeluje oficiální údaje o portálu, způsobu podání, požadavcích na účet/elektronický podpis a veřejných kontaktech poskytovatele spolu s evidencí/UNKNOWN a verificationStatus, aby UI nikdy neprezentovalo odhad jako oficiální fakt.",
  "required": [
    "schemaVersion",
    "id",
    "grantCallVersionId",
    "completenessStatus",
    "verificationStatus"
  ],
  "properties": {
    "schemaVersion": {"const": "1.0.0"},
    "id": {"type": "string", "minLength": 1},
    "grantCallVersionId": {"type": "string", "minLength": 1},
    "portalUrl": {
      "description": "Oficiální URL portálu, přes který se žádost podává; null když poskytovatel neuvádí elektronické podání.",
      "type": ["string", "null"],
      "format": "uri"
    },
    "applicationMethod": {
      "description": "Oficiální způsob podání žádosti tak, jak ho publikoval poskytovatel; null když není explicitně uveden.",
      "type": ["string", "null"],
      "enum": ["ELECTRONIC", "PAPER", "HYBRID", "EMAIL", "POSTAL", "OTHER"]
    },
    "accountRequirement": {
      "description": "Explicitní požadavek na založení účtu/profilu (např. profil občana) při podání; null když není uveden.",
      "type": ["string", "null"]
    },
    "signatureRequirement": {
      "description": "Explicitní požadavek na elektronický nebo ruční podpis při podání; null když není uveden.",
      "type": ["string", "null"]
    },
    "contactName": {
      "description": "Jméno veřejného kontaktního údaje poskytovatele pro podání žádosti; null když není uvedeno.",
      "type": ["string", "null"]
    },
    "contactRole": {
      "description": "Role veřejného kontaktního údaje poskytovatele; null když není uvedena.",
      "type": ["string", "null"]
    },
    "contactEmail": {
      "description": "E-mail veřejného kontaktního údaje poskytovatele; null když není uveden.",
      "type": ["string", "null"],
      "format": "email"
    },
    "contactPhone": {
      "description": "Telefon veřejného kontaktního údaje poskytovatele; null když není uveden.",
      "type": ["string", "null"]
    },
    "evidenceId": {
      "description": "FieldEvidence reference ukotvující tento blok submission informací na nemutabilní zdrojový dokument; null když žádný důkaz neexistuje (UNKNOWN).",
      "type": ["string", "null"],
      "minLength": 1
    },
    "completenessStatus": {
      "description": "Úroveň úplnosti submission informací dle oficiálního zdroje.",
      "enum": ["COMPLETE", "PARTIAL", "UNKNOWN"]
    },
    "verificationStatus": {
      "description": "Potvrzuje, že informace pochází z oficiálního zdroje a nikoli od uživatele.",
      "enum": [
        "AUTO_EXTRACTED",
        "PARTIALLY_VERIFIED",
        "VERIFIED",
        "NEEDS_REVIEW"
      ]
    }
  }
}
